,Velocity Europe 2012,"Most companies with outward-facing dynamic websites face the same challenges: pages must load quickly, infrastructure must scale efficiently, and sites and services must be reliable, without burning out the team or breaking the budget. Velocity is the best place on the planet for web ops and performance professionals like you to learn from your peers, exchange ideas with experts, and share best practices and lessons learned.

The Velocity Europe 2012 event will focus on the core issues and opportunities that are specific to the European performance and ops community, as well as the most significant worldwide themes and players.",Hilton London Metropole,10/2/2012,10/4/2012,"infrastructure, web operations, web ops",velocityconf.com/velocityeu2012,,,0,mbrennan,FALSE
,SMX East 2012,"Attend SMX East for tactics to increase website traffic, conversions…and sales! Choose from over 50 sessions on internet marketing topics including search engine optimization (SEO), paid search advertising, local/mobile search, social media marketing and semantic SEO.",Jacob K. Javits Convention Center,10/2/2012,10/4/2012,"search engine optimization (SEO), paid search advertising, local/mobile search, social media marketing and semantic SEO. ",searchmarketingexpo.com/east/,,,0,mbrennan,FALSE
,CEATEC JAPAN 2012,"Innovation in IT and electronics have led to the creation of smart technology that makes our lives and society in general more comfortable, and CEATEC JAPAN's mission is to relay these Japanese-origin smart innovations to the world.",Makuhari Messe ,10/2/2012,10/6/2012,communication; imaging,www.ceatec.com/2012/en/index.html,,,0,dfrancis,FALSE
,Healthcare Facilities Symposium & Expo 2012,"The Healthcare Facilities Symposium & Expo, now in its 25th year, is the original event that brings together the entire team who designs, plans, constructs and manages healthcare facilities. The Symposium, as it is affectionately called, is the forum where leaders share ideas on healthcare delivery improvement and how the physical space directly impacts the staff, patients and their families. Discover and explore ideas, practices, products and solutions that improve current and future healthcare facilities.",Navy Pier,10/2/2012,10/4/2012,healthcare,www.hcarefacilities.com/,,,0,mbrennan,FALSE
,World Business Forum New York 2012,"WOBI unifies these diverse channels.  We seek out the most innovative, influential and inspirational ideas shaping the business world and spread them around the globe – without geographical boundaries, without hierarchies, without limits.",Radio City Music Hall,10/2/2012,10/3/2012,politics,www.wobi.com/event/world-business-forum-new-york-2012,,,0,dfrancis,FALSE
,G2E 2012,Global Gaming Expo (G2E) 2012 will once again serve as the leading educational resource and ideal learning environment for this new and developing sector of the gaming industry. G2E is the premier trade show and conference event for the international gaming entertainment industry.,Sands Expo & Convention Center,10/2/2012,10/4/2012,gaming,www.globalgamingexpo.com/en/Home/,,,0,dfrancis,FALSE
,CDN World Summit 2012,CDN World Summit 2012 has become the world's leading event focusing solely on enabling and assessing the strategic and technological opportunities in the Content Delivery space.,Thistle Marble Arch Hotel,10/2/2012,10/4/2012,cdn,cdnworldsummit.com,,,0,dfrancis,FALSE
,Cloud Communications Expo 2012,"Cloud Communications Expo is where businesses seeking to integrate and leverage cloud-based communications applications, process enhancement techniques, and network based communications interfaces and architectures gather to learn and deliberate about the myriad options available.",Austin Convention Center,10/3/2012,10/5/2012,cloud-based communications,www.tmcnet.com/voip/conference/cloud-communications/,,,0,mbrennan,FALSE
,OTA 2012,"The course focuses on all aspects of orthopaedic trauma care.  Interactive teaching approaches include hands-on skills labs that emphasize common fracture stabilization and fixation techniques, small group discussions and case discussions.  The course includes concepts of bone healing, general concepts in fracture care, imaging techniques, indications for both non-operative and surgical care of fractures, and the common implications related to fracture care and related prevention and management techniques. We encourage PGY 2-4’s to attend, as well as others, who can benefit.",Minneapolis Convention Center,10/3/2012,10/6/2012,orthopaedic trauma care,www.ota.org/,,,0,mbrennan,FALSE
,GovComm 2012,"GovComm 2012 is a professional audiovisual and information communications exposition and conference designed to serve Washington, D.C.-area technology managers, end users, and procurement officers in the government and military sectors. ",Walter E. Washington Convention Center,10/3/2012,10/4/2012,government,www.govcommshow.org,,,0,dfrancis,FALSE
,COMPTEL PLUS Fall 2012,The Comptel Plus Convention & Expo is the preeminent networking event for innovative communications companies and their supplier partners. ,Gaylord Texan Hotel and Conference Center,10/5/2012,10/8/2012,communciation,comptelplus.org,,,0,dfrancis,FALSE
,NACS Show 2012,"The NACS Show provides a one-stop shopping experience for convenience and fuel retailers.  During the 1970s, the NACS Show (known then as the NACS Annual Meeting) was steadily becoming the industry's must-attend event. Attendance in the 1970s barely reached 3,000. Today, the NACS Show attracts more than 22,000 attendees from more than 60 countries.",Las Vegas Convention Center,10/7/2012,10/10/2012,fuel retailing,www.nacsonline.com/nacsshow/Pages/default.aspx,,,0,mbrennan,FALSE
,GRAPH EXPO 2012,GRAPH EXPO is the year's largest and most exciting display of 'live' running equipment in the Americas. Watching a machine run and participating in a demonstration teaches you things you just can’t learn by sitting in a conference room or looking at a brochure. This show is a problem-solving adventure designed to help you make informed purchasing decisions.,McCormick Place,10/7/2012,10/10/2012,printing technology,www.graphexpo.com,,,0,dfrancis,FALSE
,GEOINT 2012 Symposium,"The GEOINT Symposium is the nation’s largest intelligence event of the year.

The annual GEOINT Symposium, hosted by the United States Geospatial Intelligence Foundation, is the nation’s preeminent intelligence event of the year.

The GEOINT 2012 Symposium promises another agenda packed with important keynote speakers, insightful panel discussions and interesting breakout sessions.

Building on the dialogue from past Symposia, GEOINT 2012 will break new ground and bring the defense, intelligence and homeland security communities together, all in one place.",Gaylord Palms Hotel & Convention Center,10/8/2012,10/11/2012,intelligence,geoint2012.com/,,,0,mbrennan,FALSE
,HR Technology Conference 2012,"HR Technology Conference has helped attendees get the maximum business benefit from technology for HR while providing them with practical advice on the many challenges facing HR practitioners. This year’s event will focus on today’s most pressing global HR technology issues, such as cloud computing and social media across the enterprise.",McCormick Place,10/8/2012,10/9/2012,human resources,www.hrtechconference.com,,,0,dfrancis,FALSE
,MIPCOM 2012,"MIPCOM, the world’s entertainment content market is the only place where you can network, do business, discover new trends and cement partnerships face-to-face on a global level.",Palais des Festivals,10/8/2012,10/11/2012,entertainment,www.mipworld.com/mipcom/,,,0,mbrennan,FALSE
gdc_tx_2012,GDC Online 2012,"The Game Developers Conference Online (GDC Online) is the premier professionals-only event for online, social, and cloud gaming.",Austin Convention Center,10/9/2012,10/11/2012,entertainment,www.gdconline.com,,,1,dfrancis,FALSE
,VMworld Europe 2012,VMworld is the global conference for virtualization and cloud computing,Fira Barcelona Gran Via,10/9/2012,10/11/2012,virtualization and cloud computing,www.vmworld.com/community/conference/europe,,,0,mbrennan,FALSE
,INTERGEO 2012,"INTERGEO is the world’s largest event and communication platform for geodesy, geoinformation and land management.",Hanover Exhibition Center ,10/9/2012,10/11/2012,geodesy; geoinformation; land management,www.intergeo.de/en/index.html,,,0,dfrancis,FALSE
,RSA Conference Europe 2012,"RSA Conference is helping drive the information security agenda worldwide with annual industry events in the U.S., Europe and Asia. Throughout its history, RSA Conference has consistently attracted the world's best and brightest in the field, creating opportunities for conference attendees to learn about IT security's most important issues through first-hand interactions with peers, luminaries and emerging and established companies. As the IT security field continues to grow in importance and influence, RSA Conference plays an integral role in keeping security professionals across the globe connected and educated.

RSA developed the RSA Conference in 1991 as a forum for cryptographers to gather and share the latest knowledge and advancements in the area of Internet security. Today, the RSA Conference and related, RSA Conference branded activities, are still managed by RSA, the Security Division of EMC, with the support of the industry. RSA Conference event programming is judged and developed by information security practitioners and other related professionals.",Hilton London Metropole,10/9/2012,10/11/2012,security,www.rsaconference.com/events/2012/europe/index.htm,,,0,mbrennan,FALSE
,Cowen Group Therapeutics Conference 2012,Cowen and Company's conferences are major industry events attracting top institutional investors as well as leading companies in our sectors of focus.,Hilton New York,10/9/2012,10/10/2012,therapeutics,www.cowen.com/UpcomingConferences.html,,,0,dfrancis,FALSE
,SEMICON Europa 2012,SEMICON Europa is the leading forum for semiconductor and microelectronics manufacturing in Europe.,Messe Dresden,10/9/2012,10/11/2012,semiconductor and microelectronics manufacturing,www.semiconeuropa.org/,,,0,mbrennan,FALSE
,CTIA Enterprise & Applications 2012,The MobileCon event is a mobile IT and enterprise event designed specifically for the IT executive and professional. This user conference meets trade show is a one-stop shop for learning how to solve your most pressing problems in mobility. ,San Diego Convention Center,10/9/2012,10/11/2012,mobile,www.mobilecon2012.com,,,0,dfrancis,FALSE
,BioPartnering Europe 2012,"BioPartnering Future Europe™ (BPFE) represents the evolution of Europe’s longest running biopharma partnering event. BioPartnering Europe was held annually in London from 1993-2011. Together with major European stakeholders, BPE has been expanded to include partnering, finance, networking, and policy to meet the needs of a growing life science industry in Europe.

The brand name BPE was modified slightly to include the word “Future” because the life sciences are a major component of the European Commission’s 2020 vision of a globally competitive knowledge-based economy in Europe. BPFE has a pipeline of events with committed partners from across Europe. BPFE is in Europe, with Europe now, and in the future years to come.",Square Brussels Meeting Centre,10/9/2012,10/11/2012,biopharma,www.techvision.com/bpe/,,,0,mbrennan,FALSE
,BioPartnering FutureEUROPE 2012,BioPartnering Future Europe™ (BPFE) represents the evolution of Europe’s longest running biopharma partnering event. ,Square Brussels Meeting Centre,10/9/2012,10/11/2012,biotechnology; pharma,www.techvision.com/bpfe/,,,0,dfrancis,FALSE
,BIO Investor Forum 2012,"The 11th Annual BIO Investor Forum is an international biotech investor conference focused on early and established private companies as well as emerging public companies. The event features plenary sessions, business roundtables and therapeutic workshops, company presentations, and One-on-One partnering meetings.",The Palace Hotel,10/9/2012,10/10/2012,biotech,www.bio.org/events/conferences/11th-annual-bio-investor-forum,,,0,mbrennan,FALSE
,BAI Retail Delivery 2012,BAI Retail Delivery 2012 brings you the best ideas from business leaders inside and outside of financial services as well as technology solutions that enable you to formulate a strategic plan for driving profitability to move your business forward. ,Walter E. Washington Convention Center,10/9/2012,10/11/2012,retail banking; finance,www.bai.org/retaildelivery/media.aspx,,,0,dfrancis,FALSE
,AGRITECH JAPAN 2012,"Japan's leading industry trade show for agricultural materials and technology.

Exhibitors who deal with agricultural machineries, fertilisers, greenhouse related products, harvesting systems and many more gather all at once.

There is no other place where you can meet such a lot of Japanese brands and other quality suppliers from all over the world other than AGRITECH JAPAN.

Visit AGRITECH JAPAN – the perfect place to source and meet suppliers face to face!",Makuhari Messe ,10/10/2012,10/12/2012,agricultural materials and technology,www.agritechjapan.jp/en/,,,0,mbrennan,FALSE
,EXTEPO 2012,Japan's largest garden industry trade show,Makuhari Messe ,10/10/2012,10/12/2012,garden,www.gardex.jp/en/,,,0,mbrennan,FALSE
,GARDEX 2012,GARDEX is Japan's largest trade show focusing on all kinds of garden and outdoor living products.,Makuhari Messe ,10/10/2012,10/12/2012,garden; outdoor,www.gardex.jp/en/,,,0,dfrancis,OK
,IFEX 2012,"IFEX is Asia's largest and most significant business-generating trade venue in the industry. Flower and horticulture industry professionals such as florists, garden centers, home center buyers, wholesalers, importers and growers gather at IFEX.",Makuhari Messe ,10/10/2012,10/12/2012,garden; outdoor,www.ifex.jp/en/,,,0,dfrancis,OK
,TOOL JAPAN 2012,TOOL JAPAN is Japan's leading tool industry trade show.,Makuhari Messe ,10/10/2012,10/12/2012,tool; hardware,www.tooljapan.jp/en/,,,0,dfrancis,OK
,BioJapan 2012 World Business Forum,"BioJapan will be held for the 14th time in 2012 and will feature a wide array of exhibitions set up by various organizations, ranging from research institutes, universities, and venture companies possessing the latest technologies to major corporations. Moreover, a vast number of key personnel from biotechnology industries in and outside Japan will be in attendance. BioJapan provides a business partnering and matching system for bringing visitors and exhibitors together, making the event a highly effective platform for your organization to create useful opportunities and achieve its goals.",Pacifico Yokohama,10/10/2012,10/12/2012,Bio,www.ics-expo.jp/biojapan/en/index.html,,,0,mbrennan,FALSE
,Secured Cities 2012,The goal for the modern city is to create a unified response plan to major emergency situations. Secured Cities brings you top notch education on municipal video surveillance and urban security initiatives.,Pennsylvania Convention Center,10/10/2012,10/11/2012,government; security,securedcities.com,,,0,dfrancis,FALSE
,MEDTEC Ireland 2012,"Seen as a knowledge bank for Irish medical device technology professionals, MEDTEC Ireland shows best-in-class technologies, tools and tips for world-class medical device manufacturing strategies and coupled with a high-powered conference.",Radisson Blu Hotel,10/10/2012,10/11/2012,healthcare; medical devices,www.medtecireland.com/index.php,,,0,dfrancis,FALSE
,LEDs 2012,LED Conference,The Hilton San Diego Resort & Spa,10/10/2012,10/12/2012,LED,www.ledsconference.com/home.aspx,,,0,mbrennan,FALSE
,New York Comic Con 2012,"New York Comic Con is the East Coast's biggest and most exciting popular culture convention. Our show floor plays host to the latest and greatest in comics, graphic novels, anime, manga, video games, toys, movies, and television. Our panels and autograph sessions give fans a chance to interact with their favorite creators. Our screening rooms feature sneak peeks at films and television shows months before they hit either big or small screens. And with dedicated professional hours, New York Comic Con is a market place, bringing together the major players in the entertainment industry. New York Comic Con is the second largest pop culture convention in America and the only one that takes place in the comic book, publishing, media, and licensing capital of the world — Gotham City.",Jacob K. Javits Convention Center,10/11/2012,10/14/2012,comics,www.newyorkcomiccon.com/,,,0,mbrennan,FALSE
,electronicAsia 2012,"electronicAsia has adopted the theme, 'Connecting tomorrow's world…today'. Its special features which are virtually 'fairs within a fair' are World of Display Technology and World of Solar, responding very much to hot trends in the industry. electronicAsia 2012 will also feature the Hong Kong Metal Parts & Components Pavilion and hosts the World of Solar Conference.",Hong Kong Convention & Exhibition Centre,10/13/2012,10/16/2012,display technology,www.hktdc.com/fair/electronicasia-en/electronicAsia.html,,,0,dfrancis,FALSE
,DMA2012 Conference & Exhibition,Global event for real-time marketers,Mandalay Bay Convention Center,10/13/2012,10/18/2012,marketing,www.dma12.org/,,,0,mbrennan,FALSE
,GITEX TECHNOLOGY WEEK 2012,"The GItex Technology Week is one of the most significant convergence points for the leaders and members of the information technology and communications sector around the world. The event will highlight a number of relevant subjects related to ICT, current developments and future prospects along with the notable innovative methods applied in the industry.",Dubai International Convention and Exhibition Centre,10/14/2012,10/18/2012,communication; technology,www.gitex.com/,,,0,dfrancis,FALSE
,ITU Telecom World 2012,"ITU Telecom World 2012 is the leading platform for the global ICT community to connect, debate, network and share knowledge. Key stakeholders from across the entire industry ecosystem will come together in Dubai from 14 -18 October to harness the power of ICTs to create real change.",Dubai International Convention and Exhibition Centre,10/14/2012,10/18/2012,telecommunications,world2012.itu.int/,,,0,mbrennan,FALSE
,ABA Annual Convention 2012,"ABA Professional Development offers frontline, mid-management and executive level conferences designed to improve the performance of banks by improving the performance of bankers. Our programs feature expert speakers, up-to-date content and practical solutions for your bank's success.",Hilton San Diego Bayfront,10/14/2012,10/16/2012,finance,www.aba.com/Training/Conferences/Pages/annual.aspx,,,0,dfrancis,FALSE
,2012 AFP Annual Conference,The AFP Annual Conference is the largest annual meeting of corporate treasury and finance professionals in the United States. The conference offers sessions on current topics in treasury and finance and visit an exhibition hall featuring leading providers of products and services to the treasury and finance profession.,Miami Beach Convention Center,10/14/2012,10/17/2012,finance,www.afpconference.org/,,,0,dfrancis,FALSE
,CEA Industry Forum 2012,"The Consumer Electronics Association (CEA) Industry Forum is a key networking and educational event designed to inform and connect leaders in the CE industry. Industry Forum offers a chance to network with more than 400 of the industry's top executives and decision-makers from retail, manufacturer and service provider companies. Participate in membership meetings, learn about the latest market research from CEA, participate in technical standards sessions and attend programming designed to keep you up-to-date on the latest issues affecting our industry. The CEA Industry Forum helps CE executives stay current in this fast-paced and dynamic industry. The event features conference sessions, market research analysis, networking events, keynote luncheons and the Hall of Fame dinner, all designed to deliver crucial industry knowledge and connections. Continuing this year is CEA's health and fitness track which will educate attendees about revenue opportunities in this new segment of the industry.

There will also be valuable industry research programming that you can't miss. Industry Forum will showcase some of CEA's most cutting-edge research and provide a look into what's next in technology for the year ahead and beyond. The research sessions will include a look at the technology driving the economy, the retail landscape in this rapidly changing industry, and future trends to watch for in wireless broadband, next generation power supplies and health technology. In each session, leading professionals in the consumer electronics industry, as well as CEA's expert research team, will provide up-to-the-minute insight on the future of consumer electronics.The Consumer Electronics Association (CEA) Industry Forum is a key networking and educational event designed to inform and connect leaders in the CE industry. Industry Forum offers a chance to network with more than 400 of the industry's top executives and decision-makers from retail, manufacturer and service provider companies. Participate in membership meetings, learn about the latest market research from CEA, participate in technical standards sessions and attend programming designed to keep you up-to-date on the latest issues affecting our industry. The CEA Industry Forum helps CE executives stay current in this fast-paced and dynamic industry. The event features conference sessions, market research analysis, networking events, keynote luncheons and the Hall of Fame dinner, all designed to deliver crucial industry knowledge and connections. Continuing this year is CEA's health and fitness track which will educate attendees about revenue opportunities in this new segment of the industry.

There will also be valuable industry research programming that you can't miss. Industry Forum will showcase some of CEA's most cutting-edge research and provide a look into what's next in technology for the year ahead and beyond. The research sessions will include a look at the technology driving the economy, the retail landscape in this rapidly changing industry, and future trends to watch for in wireless broadband, next generation power supplies and health technology. In each session, leading professionals in the consumer electronics industry, as well as CEA's expert research team, will provide up-to-the-minute insight on the future of consumer electronics.",The Westin St. Francis,10/14/2012,10/17/2012,consumer electronics,ce.org/Events-and-Awards/Events/2012-Events/Industry-Forum,,,0,mbrennan,FALSE
,2012 Jack Henry Banking Educational Conference,"The Banking Educational Conference and Technology Showcase offers educational sessions and training classes, the opportunity to network and discuss industry trends and challenges with your peers and Jack Henry Banking's associates, and the opportunity to visit the Technology Showcase and investigate the business and banking solutions provided by Jack Henry Banking and select solutions providers.",Gaylord Texan Hotel and Conference Center,10/15/2012,10/18/2012,finance,www2.jackhenry.com/CM-INFO/conference.aspx?conferenceID=1e26e2eb-0926-4e30-9ba0-38d5709de0d7,,,0,dfrancis,FALSE
,Android Open Conference 2012,Android Open is unique because it provides essential information for the entire ecosystem of the Android community as well as the opportunity to come face to face with some of the most important Android trailblazers in the world.,Hyatt Regency San Francisco,10/15/2012,10/17/2012,mobile,androidopen.com/android2012,,,0,dfrancis,FALSE
,Esri European User Summit 2012,"Geodata AS is proud to be hosting the 2012 Esri European User Conference (EUC), October 15–17, 2012, at the Oslo Kongressenter, in Oslo, Norway.",Oslo Kongressenter,10/15/2012,10/17/2012,"GIS, software",www.esri.com/events/euc/index.html,,,0,mbrennan,FALSE
,SAP TechEd 2012 Las Vegas,"SAP TechEd is the premier technical conference offering over 1,000 hours on SAP technologies, focused on SAP NetWeaver, analytics, and mobile platforms. Enhance your skills by attending hands-on workshops, demo-driven lectures, and Q&A sessions on the latest developments in analytics, mobile, cloud, database, and in-memory computing. Make valuable connections with peers and distinguished IT professionals from our SAP community.",Sands Expo & Convention Center,10/15/2012,10/19/2012,"SAP, software, technology",www.sapteched.com/12/usa/,,,0,mbrennan,FALSE
,Digital Hollywood Fall 2012,Digital Hollywood,"The Ritz-Carlton, Marina del Rey Hotel",10/15/2012,10/18/2012,,www.digitalhollywood.com/LAFall12Agenda.html,,,0,mbrennan,FALSE
,Broadband World Forum 2012,"Broadband World Forum 2012 is the world’s largest Broadband event attracting thousands of decision-makers from across the globe. Now celebrating its 12th anniversary year, the event is the only place to meet the entire broadband industry in one place at one time.",Amsterdam RAI,10/16/2012,10/18/2012,broadband,broadbandworldforum.com/,,,0,mbrennan,FALSE
,Strata Rx 2012,"Data is driving change in the healthcare industry. In the hands of those who know how to use it, data brings advances in personalized and predictive medicine, significant cost savings, and research that points to entirely new products and markets. If you want to leverage the power of big data for your organization, you don’t want to miss the O’Reilly Strata Rx Conference.",Hilton San Francisco,10/16/2012,10/17/2012,healthcare; big data,strataconf.com/rx2012,,,0,dfrancis,FALSE
,PubCon Las Vegas 2012,"Pubcon, the premier search and social media conference and expo, will hold its multi-track Las Vegas event on October 15 – 18, 2012 at the Las Vegas Convention Center South Halls in sunny Las Vegas, Nevada.",Las Vegas Convention Center,10/16/2012,10/18/2012,"social media, search",www.pubcon.com/pubcon-vegas-2012,,,0,mbrennan,FALSE
