biopharm_america_2012,BioPharm America 2012,"BioPharm America™ is where biotech industry partnerships get started. Meet face-to-face with biotech and pharma executives from around the world to identify and enter strategic relationships. Equipped with partneringONE®, the world’s leading web-based partnering system for the life science industry, BioPharm America is the only event in North America based on the same reputable formula as EBD Group’s acclaimed European events BIO-Europe® and BIO-Europe Spring®.BioPharm America™ is where biotech industry partnerships get started. Meet face-to-face with biotech and pharma executives from around the world to identify and enter strategic relationships. Equipped with partneringONE®, the world’s leading web-based partnering system for the life science industry, BioPharm America is the only event in North America based on the same reputable formula as EBD Group’s acclaimed European events BIO-Europe® and BIO-Europe Spring®.BioPharm America™ is where biotech industry partnerships get started. Meet face-to-face with biotech and pharma executives from around the world to identify and enter strategic relationships. Equipped with partneringONE®, the world’s leading web-based partnering system for the life science industry, BioPharm America is the only event in North America based on the same reputable formula as EBD Group’s acclaimed European events BIO-Europe® and BIO-Europe Spring®.BioPharm America™ is where biotech industry partnerships get started. Meet face-to-face with biotech and pharma executives from around the world to identify and enter strategic relationships. Equipped with partneringONE®, the world’s leading web-based partnering system for the life science industry, BioPharm America is the only event in North America based on the same reputable formula as EBD Group’s acclaimed European events BIO-Europe® and BIO-Europe Spring®.BioPharm America™ is where biotech industry partnerships get started. Meet face-to-face with biotech and pharma executives from around the world to identify and enter strategic relationships. Equipped with partneringONE®, the world’s leading web-based partnering system for the life science industry, BioPharm America is the only event in North America based on the same reputable formula as EBD Group’s acclaimed European events BIO-Europe® and BIO-Europe Spring®.BioPharm America™ is where biotech industry partnerships get started. Meet face-to-face with biotech and pharma executives from around the world to identify and enter strategic relationships. Equipped with partneringONE®, the world’s leading web-based partnering system for the life science industry, BioPharm America is the only event in North America based on the same reputable formula as EBD Group’s acclaimed European events BIO-Europe® and BIO-Europe Spring®.BioPharm America™ is where biotech industry partnerships get started. Meet face-to-face with biotech and pharma executives from around the world to identify and enter strategic relationships. Equipped with partneringONE®, the world’s leading web-based partnering system for the life science industry, BioPharm America is the only event in North America based on the same reputable formula as EBD Group’s acclaimed European events BIO-Europe® and BIO-Europe Spring®.BioPharm America™ is where biotech industry partnerships get started. Meet face-to-face with biotech and pharma executives from around the world to identify and enter strategic relationships. Equipped with partneringONE®, the world’s leading web-based partnering system for the life science industry, BioPharm America is the only event in North America based on the same reputable formula as EBD Group’s acclaimed European events BIO-Europe® and BIO-Europe Spring®.BioPharm America™ is where biotech industry partnerships get started. Meet face-to-face with biotech and pharma executives from around the world to identify and enter strategic relationships. Equipped with partneringONE®, the world’s leading web-based partnering system for the life science industry, BioPharm America is the only event in North America based on the same reputable formula as EBD Group’s acclaimed European events BIO-Europe® and BIO-Europe Spring®.BioPharm America™ is where biotech industry partnerships get started. Meet face-to-face with biotech and pharma executives from around the world to identify and enter strategic relationships. Equipped with partneringONE®, the world’s leading web-based partnering system for the life science industry, BioPharm America is the only event in North America based on the same reputable formula as EBD Group’s acclaimed European events BIO-Europe® and BIO-Europe Spring®.BioPharm America™ is where biotech industry partnerships get started. Meet face-to-face with biotech and pharma executives from around the world to identify and enter strategic relationships. Equipped with partneringONE®, the world’s leading web-based partnering system for the life science industry, BioPharm America is the only event in North America based on the same reputable formula as EBD Group’s acclaimed European events BIO-Europe® and BIO-Europe Spring®.BioPharm America™ is where biotech industry partnerships get started. Meet face-to-face with biotech and pharma executives from around the world to identify and enter strategic relationships. Equipped with partneringONE®, the world’s leading web-based partnering system for the life science industry, BioPharm America is the only event in North America based on the same reputable formula as EBD Group’s acclaimed European events BIO-Europe® and BIO-Europe Spring®.BioPharm America™ is where biotech industry partnerships get started. Meet face-to-face with biotech and pharma executives from around the world to identify and enter strategic relationships. Equipped with partneringONE®, the world’s leading web-based partnering system for the life science industry, BioPharm America is the only event in North America based on the same reputable formula as EBD Group’s acclaimed European events BIO-Europe® and BIO-Europe Spring®.BioPharm America™ is where biotech industry partnerships get started. Meet face-to-face with biotech and pharma executives from around the world to identify and enter strategic relationships. Equipped with partneringONE®, the world’s leading web-based partnering system for the life science industry, BioPharm America is the only event in North America based on the same reputable formula as EBD Group’s acclaimed European events BIO-Europe® and BIO-Europe Spring®.BioPharm America™ is where biotech industry partnerships get started. Meet face-to-face with biotech and pharma executives from around the world to identify and enter strategic relationships. Equipped with partneringONE®, the world’s leading web-based partnering system for the life science industry, BioPharm America is the only event in North America based on the same reputable formula as EBD Group’s acclaimed European events BIO-Europe® and BIO-Europe Spring®.BioPharm America™ is where biotech industry partnerships get started. Meet face-to-face with biotech and pharma executives from around the world to identify and enter strategic relationships. Equipped with partneringONE®, the world’s leading web-based partnering system for the life science industry, BioPharm America is the only event in North America based on the same reputable formula as EBD Group’s acclaimed European events BIO-Europe® and BIO-Europe Spring®.BioPharm America™ is where biotech industry partnerships get started. Meet face-to-face with biotech and pharma executives from around the world to identify and enter strategic relationships. Equipped with partneringONE®, the world’s leading web-based partnering system for the life science industry, BioPharm America is the only event in North America based on the same reputable formula as EBD Group’s acclaimed European events BIO-Europe® and BIO-Europe Spring®.BioPharm America™ is where biotech industry partnerships get started. Meet face-to-face with biotech and pharma executives from around the world to identify and enter strategic relationships. Equipped with partneringONE®, the world’s leading web-based partnering system for the life science industry, BioPharm America is the only event in North America based on the same reputable formula as EBD Group’s acclaimed European events BIO-Europe® and BIO-Europe Spring®.BioPharm America™ is where biotech industry partnerships get started. Meet face-to-face with biotech and pharma executives from around the world to identify and enter strategic relationships. Equipped with partneringONE®, the world’s leading web-based partnering system for the life science industry, BioPharm America is the only event in North America based on the same reputable formula as EBD Group’s acclaimed European events BIO-Europe® and BIO-Europe Spring®.BioPharm America™ is where biotech industry partnerships get started. Meet face-to-face with biotech and pharma executives from around the world to identify and enter strategic relationships. Equipped with partneringONE®, the world’s leading web-based partnering system for the life science industry, BioPharm America is the only event in North America based on the same reputable formula as EBD Group’s acclaimed European events BIO-Europe® and BIO-Europe Spring®.BioPharm America™ is where biotech industry partnerships get started. Meet face-to-face with biotech and pharma executives from around the world to identify and enter strategic relationships. Equipped with partneringONE®, the world’s leading web-based partnering system for the life science industry, BioPharm America is the only event in North America based on the same reputable formula as EBD Group’s acclaimed European events BIO-Europe® and BIO-Europe Spring®.BioPharm America™ is where biotech industry partnerships get started. Meet face-to-face with biotech and pharma executives from around the world to identify and enter strategic relationships. Equipped with partneringONE®, the world’s leading web-based partnering system for the life science industry, BioPharm America is the only event in North America based on the same reputable formula as EBD Group’s acclaimed European events BIO-Europe® and BIO-Europe Spring®.BioPharm America™ is where biotech industry partnerships get started. Meet face-to-face with biotech and pharma executives from around the world to identify and enter strategic relationships. Equipped with partneringONE®, the world’s leading web-based partnering system for the life science industry, BioPharm America is the only event in North America based on the same reputable formula as EBD Group’s acclaimed European events BIO-Europe® and BIO-Europe Spring®.BioPharm America™ is where biotech industry partnerships get started. Meet face-to-face with biotech and pharma executives from around the world to identify and enter strategic relationships. Equipped with partneringONE®, the world’s leading web-based partnering system for the life science industry, BioPharm America is the only event in North America based on the same reputable formula as EBD Group’s acclaimed European events BIO-Europe® and BIO-Europe Spring®.BioPharm America™ is where biotech industry partnerships get started. Meet face-to-face with biotech and pharma executives from around the world to identify and enter strategic relationships. Equipped with partneringONE®, the world’s leading web-based partnering system for the life science industry, BioPharm America is the only event in North America based on the same reputable formula as EBD Group’s acclaimed European events BIO-Europe® and BIO-Europe Spring®.",Westin Boston Waterfront,9/19/2012,09/21/12,"biopharma, healthcare",ebdgroup.com/bpa/index.php,,,,0,MB,FALSE
birtv2012,BIRTV2012,"BIRTV is the top-notch exhibition in the industries of radio, film & TV technology and equipments in China.BIRTV is the top-notch exhibition in the industries of radio, film & TV technology and equipments in China.BIRTV is the top-notch exhibition in the industries of radio, film & TV technology and equipments in China.BIRTV is the top-notch exhibition in the industries of radio, film & TV technology and equipments in China.BIRTV is the top-notch exhibition in the industries of radio, film & TV technology and equipments in China.BIRTV is the top-notch exhibition in the industries of radio, film & TV technology and equipments in China.BIRTV is the top-notch exhibition in the industries of radio, film & TV technology and equipments in China.BIRTV is the top-notch exhibition in the industries of radio, film & TV technology and equipments in China.BIRTV is the top-notch exhibition in the industries of radio, film & TV technology and equipments in China.BIRTV is the top-notch exhibition in the industries of radio, film & TV technology and equipments in China.BIRTV is the top-notch exhibition in the industries of radio, film & TV technology and equipments in China.BIRTV is the top-notch exhibition in the industries of radio, film & TV technology and equipments in China.BIRTV is the top-notch exhibition in the industries of radio, film & TV technology and equipments in China.BIRTV is the top-notch exhibition in the industries of radio, film & TV technology and equipments in China.BIRTV is the top-notch exhibition in the industries of radio, film & TV technology and equipments in China.BIRTV is the top-notch exhibition in the industries of radio, film & TV technology and equipments in China.BIRTV is the top-notch exhibition in the industries of radio, film & TV technology and equipments in China.BIRTV is the top-notch exhibition in the industries of radio, film & TV technology and equipments in China.BIRTV is the top-notch exhibition in the industries of radio, film & TV technology and equipments in China.BIRTV is the top-notch exhibition in the industries of radio, film & TV technology and equipments in China.BIRTV is the top-notch exhibition in the industries of radio, film & TV technology and equipments in China.BIRTV is the top-notch exhibition in the industries of radio, film & TV technology and equipments in China.BIRTV is the top-notch exhibition in the industries of radio, film & TV technology and equipments in China.BIRTV is the top-notch exhibition in the industries of radio, film & TV technology and equipments in China.BIRTV is the top-notch exhibition in the industries of radio, film & TV technology and equipments in China.",China International Exhibition Center (CIEC),8/22/2012,08/25/12,"radio, film, technology",chinaexhibition.com/trade_events/1069-BIRTV_2012.html,,,,0,DF,FALSE
brand_licensing_europe_2012,Brand Licensing Europe 2012,"These seminars, workshops and panel discussions are designed especially for European retailers and licensees to advance their licensing skills base and learn from industry experts about the latest trends and opportunities.","National Hall, Olympia",10/16/2012,10/18/12,licensing; product lifecycle,brandlicensing.eu/licensing-academy/,,,,0,MB,FALSE
broadband_world_forum_2012,Broadband World Forum 2012,"Broadband World Forum 2012 is the world’s largest Broadband event attracting thousands of decision-makers from across the globe. Now celebrating its 12th anniversary year, the event is the only place to meet the entire broadband industry in one place at one time.",Amsterdam RAI,10/16/2012,10/18/12,broadband,broadbandworldforum.com/,,,,0,DF,FALSE
bsr_conference_2012,BSR Conference 2012,"The BSR Conference 2012 will help companies create lasting change over the years to come. Bringing together a global community of more than 1,000 leaders from business, civil society, and the public sector, the annual BSR Conference is one of the world’s largest and most influential events devoted to sustainable business. Our 20th anniversary Conference agenda will provide the inspiration, networking, and practical learning to fast forward your progress toward a just and sustainable world.",,10/23/2012,10/26/12,sustainable business,bsr.org/en/bsr-conference,,,,0,MB,OK
carrier_ethernet_world_congress_2012,Carrier Ethernet World Congress 2012,"Carrier Ethernet World Congress is the leading forum for discussion, networking and debate on the status of the Carrier Ethernet industry.",Hotel Fira Palace,9/17/2012,09/20/12,internet,carrierethernetworld.com,,,,0,DF,FALSE
cartes_2012,Cartes 2012,"Smart solutions for security, payment, identification, & mobility conference",Paris Nord Villepinte Exhibition Centre,11/6/2012,11/08/12,"security, payment, identification, & mobility",cartes.com/,,,,0,MB,FALSE
cartes_america_2013,CARTES America 2013,"The exhibition and conference will gather industry experts and end-users to discover the latest developments around NFC, Mobile Payment and EMV migration, as well as Identification and Authentication Solutions.The exhibition and conference will gather industry experts and end-users to discover the latest developments around NFC, Mobile Payment and EMV migration, as well as Identification and Authentication Solutions.The exhibition and conference will gather industry experts and end-users to discover the latest developments around NFC, Mobile Payment and EMV migration, as well as Identification and Authentication Solutions.The exhibition and conference will gather industry experts and end-users to discover the latest developments around NFC, Mobile Payment and EMV migration, as well as Identification and Authentication Solutions.The exhibition and conference will gather industry experts and end-users to discover the latest developments around NFC, Mobile Payment and EMV migration, as well as Identification and Authentication Solutions.The exhibition and conference will gather industry experts and end-users to discover the latest developments around NFC, Mobile Payment and EMV migration, as well as Identification and Authentication Solutions.The exhibition and conference will gather industry experts and end-users to discover the latest developments around NFC, Mobile Payment and EMV migration, as well as Identification and Authentication Solutions.The exhibition and conference will gather industry experts and end-users to discover the latest developments around NFC, Mobile Payment and EMV migration, as well as Identification and Authentication Solutions.The exhibition and conference will gather industry experts and end-users to discover the latest developments around NFC, Mobile Payment and EMV migration, as well as Identification and Authentication Solutions.The exhibition and conference will gather industry experts and end-users to discover the latest developments around NFC, Mobile Payment and EMV migration, as well as Identification and Authentication Solutions.The exhibition and conference will gather industry experts and end-users to discover the latest developments around NFC, Mobile Payment and EMV migration, as well as Identification and Authentication Solutions.The exhibition and conference will gather industry experts and end-users to discover the latest developments around NFC, Mobile Payment and EMV migration, as well as Identification and Authentication Solutions.The exhibition and conference will gather industry experts and end-users to discover the latest developments around NFC, Mobile Payment and EMV migration, as well as Identification and Authentication Solutions.The exhibition and conference will gather industry experts and end-users to discover the latest developments around NFC, Mobile Payment and EMV migration, as well as Identification and Authentication Solutions.The exhibition and conference will gather industry experts and end-users to discover the latest developments around NFC, Mobile Payment and EMV migration, as well as Identification and Authentication Solutions.The exhibition and conference will gather industry experts and end-users to discover the latest developments around NFC, Mobile Payment and EMV migration, as well as Identification and Authentication Solutions.The exhibition and conference will gather industry experts and end-users to discover the latest developments around NFC, Mobile Payment and EMV migration, as well as Identification and Authentication Solutions.The exhibition and conference will gather industry experts and end-users to discover the latest developments around NFC, Mobile Payment and EMV migration, as well as Identification and Authentication Solutions.The exhibition and conference will gather industry experts and end-users to discover the latest developments around NFC, Mobile Payment and EMV migration, as well as Identification and Authentication Solutions.The exhibition and conference will gather industry experts and end-users to discover the latest developments around NFC, Mobile Payment and EMV migration, as well as Identification and Authentication Solutions.The exhibition and conference will gather industry experts and end-users to discover the latest developments around NFC, Mobile Payment and EMV migration, as well as Identification and Authentication Solutions.The exhibition and conference will gather industry experts and end-users to discover the latest developments around NFC, Mobile Payment and EMV migration, as well as Identification and Authentication Solutions.The exhibition and conference will gather industry experts and end-users to discover the latest developments around NFC, Mobile Payment and EMV migration, as well as Identification and Authentication Solutions.The exhibition and conference will gather industry experts and end-users to discover the latest developments around NFC, Mobile Payment and EMV migration, as well as Identification and Authentication Solutions.The exhibition and conference will gather industry experts and end-users to discover the latest developments around NFC, Mobile Payment and EMV migration, as well as Identification and Authentication Solutions.",The Mirage,4/21/2013,04/24/13,"NFC, Mobile Payment and EMV migration",cartes-america.com/,,,,0,DF,FALSE
cdn_world_summit_2012,CDN World Summit 2012,CDN World Summit 2012 has become the world's leading event focusing solely on enabling and assessing the strategic and technological opportunities in the Content Delivery space.,Thistle Marble Arch Hotel,10/2/2012,10/04/12,cdn,cdnworldsummit.com,,,,0,MB,FALSE
cea_industry_forum_2012,CEA Industry Forum 2012,,The Westin St. Francis,10/14/2012,10/17/12,consumer electronics,ce.org/Events-and-Awards/Events/2012-Events/Industry-Forum,,,,0,DF,FALSE
ceatec_japan_2012,CEATEC JAPAN 2012,"Innovation in IT and electronics have led to the creation of smart technology that makes our lives and society in general more comfortable, and CEATEC JAPAN's mission is to relay these Japanese-origin smart innovations to the world.",Makuhari Messe ,10/2/2012,10/06/12,communication; imaging,ceatec.com/2012/en/index.html,,,,0,MB,FALSE
