,VISION 2012,"VISION is the most important trade fair for machine vision. Anyone who has anything to do with machine vision —from start-up companies to global corporations, from component manufacturers to systems integrators—is present at this unparalleled industry event.",Landesmesse Stuttgart ,11/6/2012,11/8/2012,machine vision,www.messestuttgart.de/cms/vision2012_aussteller_messe.0.html?&L=1,,,0,dfrancis,FALSE
,"Piper Jaffray Technology, Media & Telecommunications Conference 2012","Piper Jaffray hosts several client conferences and events each year focusing on clean technology & renewables, consumer, healthcare, industrials and technology, media & telecommunications. We believe that in-depth industry and product knowledge play a critical role in our clients' success.",Le Parker Meridien,11/6/2012,11/7/2012,finance; technology; media; telecom,www.piperjaffray.com/2col.aspx?id=365,,,0,dfrancis,FALSE
noah_london_2012,Noah Conference London 2012,"The preeminent European event where Internet CEOs, executives and investors gain deep insights into the latest proven concepts, network with senior executives and establish new business relationships. ",Old Billingsgate,11/6/2012,11/7/2012,internet; technology,www.noah-conference.com,,,0,dfrancis,FALSE
,Cartes 2012,"Smart solutions for security, payment, identification, & mobility conference",Paris Nord Villepinte Exhibition Centre,11/6/2012,11/8/2012,"security, payment, identification, & mobility",www.cartes.com/,,,0,mbrennan,FALSE
,FinovateAsia 2012,"On November 6, Finovate travels to Singapore to unveil FinovateAsia 2012, a new one-day showcase of the best innovations in financial and banking technology from a mixture of leading established companies and brand-new startups.

The inaugural FinovateAsia will feature our signature demo-only format with 32 companies receiving just 7 minutes on stage to demo their latest innovations to the entire audience. A networking session at the end of the day will give you the chance to speak directly with the innovators you saw on stage. Finovate events typically attract financial institution executives, venture capitalists, members of the press and entrepreneurs in the space, and we expect to see a similar diverse crowd this November.

Don’t miss out on your chance to see the next big fintech innovation (before your competition does). Register now and lock in your spot today!",Singapore Expo,11/6/2012,11/6/2012,financial and banking technology,finovate.com/asia2012/,,,0,mbrennan,FALSE
,OTTtv World Summit 2012,It continues to be the predominant event globally on over-the-top-television attracting the innovators and thought leaders who are driving the industry forward in this exciting new area.,Thistle Marble Arch,11/6/2012,11/8/2012,television; entertainment,ottworldsummit.com/,,,0,dfrancis,FALSE
,XBRL25,XBRL25 will feature learning tracks covering all of the latest developments and trends in using XBRL to improve the efficiency and quality of business reporting.,Yokohama Royal Park Hotel,11/6/2012,11/8/2012,"XBLR, technology",conference.xbrl.org/,,,0,mbrennan,FALSE
,MIPIM Asia 2012,A key commercial real estate show for professionals in Asia,Hong Kong Convention & Exhibition Centre,11/7/2012,11/9/2012,real estate,www.mipim.com/en/mipim-asia/,,,0,mbrennan,FALSE
adtech_ny_2012,ad:tech,"Sessions covering today’s pivotal topics, include Brand and Agency Issues, Display, Innovation, Mobile, ROI, Social, Tablets, Targeting, Video, Start Up Technology, Media and more.",Jacob K. Javits Convention Center,11/7/2012,11/8/2012,advertising,www.ad-tech.com/ny,,,1,n/a,FALSE
,MEMS Executive Congress 2012,MEMS Executive Congress is the annual conference and networking event for the MEMS industry. It is a unique professional forum at which executives from companies designing and manufacturing MEMS technology sit side-by-side with their end-user customers in panel discussions and networking events to exchange ideas and information about the use of MEMS in commercial applications.,The Westin Kierland Resort & Spa,11/7/2012,11/9/2012,MEMS,www.eiseverywhere.com/ehome/index.php?eventid=35310,,,0,dfrancis,FALSE
gstar_busan_2012,G-Star 2012,Global game exhibition,Busan Exhibition and Convention Center (BEXCO),11/8/2012,11/11/2012,entertainment,www.gstar.or.kr/eng,,,1,n/a,FALSE
,VISUALIZED Conference 2012,"Visualized is a unique conference on data, design, and the evolution of information communication. We will bring together 400+ creative leaders, information designers, and data visualization enthusiasts for a highly visual and inspiring two-day event.",Times Center,11/8/2012,11/9/2012,big data; design,visualized.com/webgl.html,,,0,dfrancis,FALSE
,electronica 2012,"25th International trade fair for electonic components, systems, and applications",Messe Munchen,11/9/2012,11/12/2012,"electonic components, systems, and applications",electronicaautomotive.de/en/home,,,0,mbrennan,FALSE
,Healthcare IT Summit 2012,"The Healthcare IT Summit brings together industry analysts, IT executives from healthcare insurer and provider organizations, and leading vendors for uniquely collaborative discussions on today’s pressing business and IT issues, best practices and the latest tools and technology that will improve the performance of your business.",Hyatt Regency Grand Cypress,11/11/2012,11/13/2012,healthcare; technology,www.xchange-events.com/hcits12,,,0,dfrancis,FALSE
,IHMRS 2012,"The IHMRS has long been considered the international showcase for the hospitality industry, positioning your company in front of owners and operators from the leading hotel chains as well as independent properties.",Jacob K. Javits Convention Center,11/11/2012,11/13/2012,hospitality,www.ihmrs.com/,,,0,dfrancis,FALSE
,NUCLEAR POWER International 2012,"Now in its sixth year, NUCLEAR POWER International 2012 provides the nuclear power industry the perfect venue to gather and exchange information about nuclear power’s role in today’s changing world. 

Co-located again with POWER-GEN International, the attendees of both events reap the benefits of two powerful shows under one roof. As an exhibitor at NUCLEAR POWER International you get unmatched exposure to thousands of potential new customers.",Orange County Convention Center,11/11/2012,11/13/2012,nuclear power,www.power-gen.com/sponsor/npi.html,,,0,mbrennan,FALSE
,TDWI Orlando 2012,"In the new big data environment that is coming to be, it’s all about volume, variety, and velocity. Data from multiple sources is arriving in large volumes on a near-continuous basis. How can you analyze it all fast enough to make informed decisions? Agile development, cloud computing, text analytics, virtualization, open source, cool BI, Web 2.0, social media, and mobile BI are evolving. New methods of working with big data, such as Hadoop and MapReduce, offer alternatives to traditional data warehousing—if you know how and when to use them.",Renaissance Orlando Hotel at SeaWorld,11/11/2012,11/13/2012,big data,tdwi.org/calendar/2012/11/world-conference-emerging-technologies-2013.aspx,,,0,mbrennan,FALSE
,BIO-Europe 2012,"BIO-Europe® is Europe's largest partnering conference, serving the global biotechnology industry. The conference annually attracts leading dealmakers from biotech, pharma and finance along with the most exciting emerging companies. ",Congress Center Hamburg,11/12/2012,11/14/2012,biotechnology,www.ebdgroup.com/bioeurope/index.php,,,0,dfrancis,FALSE
sharepoint_lv_2012,Sharepoint Conference 2012,Microsoft's Annual Sharepoint Conference,Mandalay Bay Convention Center,11/12/2012,11/15/2012,sharepoint,www.mssharepointconference.com,,,1,n/a,FALSE
,SC12,"For 24 years, SC has been at the forefront in gathering the best and brightest minds in supercomputing together, with our unparalleled technical papers, tutorials, posters and speakers. SC12 will take a major step forward not only in supercomputing, but in super-conferencing, with everything designed to make the 2012 conference the most ‘you’ friendly conference in the world. We’re streamlining conference information and moving to a virtually real-time method of determining technical program thrusts. No more pre-determined technical themes picked far in advance. Through social media, data mining, and active polling, we’ll see which technical interests and issues emerge throughout the year, and focus on the ones that interest you the most.",Salt Palace Convention Center,11/12/2012,11/15/2012,supercomputing,sc12.supercomputing.org/,,,0,mbrennan,FALSE
,2013 CES Unveiled NEW YORK,Get a sneak peek at this year's hottest products two months before the 2013 International CES even begins!,The Metropolitan Pavilion,11/12/2012,11/12/2012,consumer electronics,ce.org/Events-and-Awards/Event-Overview.aspx,,,0,mbrennan,FALSE
,2013 CES New York Press Preview,"CES New York Press Preview is a must-attend preview of hot holiday products, the highly anticipated release of CEA’s annual holiday sales forecast, and the latest news about the 2013 International CES. ",The Metropolitan Pavilion,11/12/2012,11/12/2012,consumer electronics,ce.org/Events-and-Awards/Events/2012-Events/International-CES-New-York-Press-Preview-featu,,,0,dfrancis,FALSE
,William Blair Healthcare Conference 2012,,,11/12/2012,11/13/2012,,,,,0,dfrancis,OK
,SES Chicago 2012,"SES Conference & Expo provides marketing professionals, brand advertisers, agencies, and business leaders with the knowledge and tools needed to traverse the dynamic digital landscape. Designed for you by industry thought leaders and innovators, our instructional program will meet your needs whatever your experience level.",,11/12/2012,11/16/2012,"marketing professionals, brand advertisers, agencies,",sesconference.com/chicago/,,,0,mbrennan,OK
,NHCAA Annual Training Conference 2012,"The NHCAA Institute for Health Care Fraud Prevention's Annual Training Conference (ATC) is NHCAA's premiere annual event, recognized industry-wide as the nation's leading health care anti-fraud forum.",Anaheim Marriott,11/13/2012,11/16/2012,healthcare; anti-fraud,www.nhcaa.org/education/annual-training-conference.aspx,,,0,dfrancis,FALSE
,AfricaCom 2012,"A game-changing shift in Africa's digital communications market - Adapt or Lose Out. Africa Com 2012 will help you rise to this  challenge having gathered a veritable treasure-trove of  inspirational speakers that will challenge the status quo for all stakeholders: telcos, disruptive OTT players; content providers; vendors and end-users.",Cape Town Convention Centre,11/13/2012,11/15/2012,communication,africa.comworldseries.com/,,,0,dfrancis,FALSE
,OSP EXPO 2012,"OSP EXPO is the only telecom trade show that takes attendees deep into the heart of everything network related, from FTTCs and Wireless Backhaul to the frenetic evolution toward 100G. ",Colorado Convention Center,11/13/2012,11/15/2012,networking,www.ospmag.com/expo,,,0,dfrancis,FALSE
,SAPPHIRE NOW 2012 Madrid,Transform your business with essential information and best practices for business executives.,Feria de Madrid,11/13/2012,11/15/2012,"SAP, business development",www.sapphirenowsapteched.com/,,,0,mbrennan,FALSE
,SAP TechEd 2012 Madrid,Get access to the entire SAP ecosystem and learn how SAP can help your organization run like never before. Run smarter with education for IT professionals. Over 500 hours of hands-on workshops and in-depth technical training plus access to all SAPPHIRE NOW content.,Feria de Madrid,11/13/2012,11/16/2012,SAP,www.sapphirenowsapteched.com/index.aspx#.UDzkDNZlSHg,,,0,dfrancis,FALSE
,Smart City Expo World Congress 2012,"The population density in cities demands action to be taken to provide sustainable economic and environmental growth that is capable of improving the quality of life of their inhabitants. This is the main challenge facing us and the reason why society is calling for more intelligent cities, or Smart Cities.",Fira Gran Via,11/13/2012,11/15/2012,"smart cities, urban design",www.smartcityexpo.com/en/home,,,0,mbrennan,FALSE
,SATIS 2012,The event of the entire professional community of IT industry image and sound.,Halle Freyssinet (La),11/13/2012,11/15/2012,"Image, sound, information technology",www.satis-expo.com/,,,0,mbrennan,FALSE
,Stephens Inc. Fall Investment Conference 2012,"Annual fall conference will feature over 100 private and publicly traded companies from the energy, healthcare, industrials, technology and transportation industries. Call your Stephens representative to register",,11/13/2012,11/16/2012,"energy, healthcare, industrials, technology and transportation ",www.stephens.com/research/events.aspx,,,0,mbrennan,OK
,Africa Cast 2012,"africaCast returns for a second year and continues to be the premier event in Sub Saharan Africa for broadcasters. This year we have the support of SABC, ABN, Endemol and Viacom; among many other major broadcasters who have provided CXO level speakers to discuss the future opportunities for African broadcasters. The event will provide a vital platform for all stakeholders to engage and debate how best to monetise the future of African broadcasting.africaCast returns for a second year and continues to be the premier event in Sub Saharan Africa for broadcasters. This year we have the support of SABC, ABN, Endemol and Viacom; among many other major broadcasters who have provided CXO level speakers to discuss the future opportunities for African broadcasters. The event will provide a vital platform for all stakeholders to engage and debate how best to monetise the future of African broadcasting.africaCast returns for a second year and continues to be the premier event in Sub Saharan Africa for broadcasters. This year we have the support of SABC, ABN, Endemol and Viacom; among many other major broadcasters who have provided CXO level speakers to discuss the future opportunities for African broadcasters. The event will provide a vital platform for all stakeholders to engage and debate how best to monetise the future of African broadcasting.africaCast returns for a second year and continues to be the premier event in Sub Saharan Africa for broadcasters. This year we have the support of SABC, ABN, Endemol and Viacom; among many other major broadcasters who have provided CXO level speakers to discuss the future opportunities for African broadcasters. The event will provide a vital platform for all stakeholders to engage and debate how best to monetise the future of African broadcasting.africaCast returns for a second year and continues to be the premier event in Sub Saharan Africa for broadcasters. This year we have the support of SABC, ABN, Endemol and Viacom; among many other major broadcasters who have provided CXO level speakers to discuss the future opportunities for African broadcasters. The event will provide a vital platform for all stakeholders to engage and debate how best to monetise the future of African broadcasting.africaCast returns for a second year and continues to be the premier event in Sub Saharan Africa for broadcasters. This year we have the support of SABC, ABN, Endemol and Viacom; among many other major broadcasters who have provided CXO level speakers to discuss the future opportunities for African broadcasters. The event will provide a vital platform for all stakeholders to engage and debate how best to monetise the future of African broadcasting.",Cape Town Convention Centre,11/14/2012,11/15/2012,broadcasting,www.africacast-event.com/,,,0,mbrennan,FALSE
,4G Latin America 2012,"The first large-scale industry gathering focused solely on 4G in Latin America, including LTE, backhaul, transport, spectrum, WiMAX and satellite.",Crowne Plaza Tequendama Bogota,11/14/2012,11/15/2012,wireless; mobile,www.4glatinamerica.com/,,,0,dfrancis,FALSE
,Content & Communications World 2012,"At CCW you stand at the crossroads of creativity and technology. Thousands of attendees and exhibitors alike participate in the ever-changing conversation surrounding content creation, management and distribution/delivery. You will interact not only with the latest products and technology, but with peers who share your passion for your craft.",Jacob K. Javits Convention Center,11/14/2012,11/15/2012,"content creation, management and distribution/delivery",www.ccwexpo.com/,,,0,mbrennan,FALSE
,SATCON 2012,"At SATCON, you stand at the crossroads of innovation and communications. Thousands of attendees and exhibitors alike participate in the ever-changing conversation surrounding satellite-enabled communications and content delivery.

Government/military, media & entertainment, telecommunications, commercial, mobile satellite and enterprise organizations attend SATCON to see the latest products and technologies, network with peers and find potential partners and solution providers. 
SATCON provides you with actionable information and knowledge to keep pace with the ever-changing global communications market.

Collaborate with industry leaders who deliver insight and information on emerging technologies. Keep up with what's trending in the world of satellite communications. SATCON is part of the Content & Communications World (CCW) family of events.At SATCON, you stand at the crossroads of innovation and communications. Thousands of attendees and exhibitors alike participate in the ever-changing conversation surrounding satellite-enabled communications and content delivery.

Government/military, media & entertainment, telecommunications, commercial, mobile satellite and enterprise organizations attend SATCON to see the latest products and technologies, network with peers and find potential partners and solution providers. 
SATCON provides you with actionable information and knowledge to keep pace with the ever-changing global communications market.

Collaborate with industry leaders who deliver insight and information on emerging technologies. Keep up with what's trending in the world of satellite communications. SATCON is part of the Content & Communications World (CCW) family of events.At SATCON, you stand at the crossroads of innovation and communications. Thousands of attendees and exhibitors alike participate in the ever-changing conversation surrounding satellite-enabled communications and content delivery.

Government/military, media & entertainment, telecommunications, commercial, mobile satellite and enterprise organizations attend SATCON to see the latest products and technologies, network with peers and find potential partners and solution providers. 
SATCON provides you with actionable information and knowledge to keep pace with the ever-changing global communications market.

Collaborate with industry leaders who deliver insight and information on emerging technologies. Keep up with what's trending in the world of satellite communications. SATCON is part of the Content & Communications World (CCW) family of events.At SATCON, you stand at the crossroads of innovation and communications. Thousands of attendees and exhibitors alike participate in the ever-changing conversation surrounding satellite-enabled communications and content delivery.

Government/military, media & entertainment, telecommunications, commercial, mobile satellite and enterprise organizations attend SATCON to see the latest products and technologies, network with peers and find potential partners and solution providers. 
SATCON provides you with actionable information and knowledge to keep pace with the ever-changing global communications market.

Collaborate with industry leaders who deliver insight and information on emerging technologies. Keep up with what's trending in the world of satellite communications. SATCON is part of the Content & Communications World (CCW) family of events.At SATCON, you stand at the crossroads of innovation and communications. Thousands of attendees and exhibitors alike participate in the ever-changing conversation surrounding satellite-enabled communications and content delivery.

Government/military, media & entertainment, telecommunications, commercial, mobile satellite and enterprise organizations attend SATCON to see the latest products and technologies, network with peers and find potential partners and solution providers. 
SATCON provides you with actionable information and knowledge to keep pace with the ever-changing global communications market.

Collaborate with industry leaders who deliver insight and information on emerging technologies. Keep up with what's trending in the world of satellite communications. SATCON is part of the Content & Communications World (CCW) family of events.",Jacob K. Javits Convention Center,11/14/2012,11/15/2012,satellite-enabled communications and content delivery.,www.satconexpo.com/,,,0,mbrennan,OK
,Inter BEE 2012,"Inter BEE has established itself as an international exhibition showcasing top-level domestic and overseas broadcast, video, audio and lighting equipment as well as peripheral applications and solutions all under one roof.",Makuhari Messe ,11/14/2012,11/16/2012,audio; video; communcation,www.inter-bee.com/en/,,,0,dfrancis,OK
,MEDICA 2012,"International Trade Fair and Congress for Medical Technology, Electromedicine, Laboratory Equipment, Diagnostics and Drugs",Messe Düsseldorf,11/14/2012,11/17/2012,"Medical Technology, Electromedicine, Laboratory Equipment, Diagnostics and Drugs",www.medica-tradefair.com/,,,0,mbrennan,FALSE
,Greenbuild 2012,"Greenbuild is the world's largest conference and expo dedicated to green building. Greenbuild brings together industry leaders, experts and frontline professionals dedicated to sustainable building in their everyday work, and a unique energy is sparked.",Moscone Center,11/14/2012,11/16/2012,environmental,www.greenbuildexpo.org/Home.aspx,,,0,dfrancis,OK
,MAPIC 2012,"MAPIC provides a unique exhibition area and conference series dedicated to retail real estate. It brings together retail and real estate leaders to explore the most innovative projects, discover new retail properties, forge partnerships, close deals, and stay on top of trends and innovation in the retail real estate industry.",Palais des Festivals,11/14/2012,11/16/2012,real estate,www.mipim.com/en/mapic/,,,0,dfrancis,FALSE
,AeroCon Montreal 2012,"Introducing the exhibition for the aerospace and defense industries where suppliers will showcase the software, materials, components, sub-assemblies, contract services, electronics, robotics, and equipment used in the design and production of aerospace and defense products.",,11/14/2012,11/15/2012,aerospace and defense,www.canontradeshows.com/expo/aerocon12/mon_index.html,,,0,mbrennan,OK
,Jefferies Global Healthcare Conference London 2012,"The conference will feature public and private leading global pharmaceutical companies within the areas of pharmaceuticals, biotech, generics, medtech and healthcare services from the US, Central and Eastern Europe, Latin America, China and India.",,11/14/2012,11/15/2012,healthcare; technology,www.jefferies.com/cositemgr.pl/html/OurFirm/ConferencesEvents/upcoming/2012GlobalHealthcareConferenceinLondon.shtml,,,0,dfrancis,OK
,Needham HDD/Flash Memory & Systems Conference 2012,"The unique, focused-nature of this conference attracts the most important thought leaders in the storage world, spanning HDDs, solid statedrives, PCIe, and flash-based next generation storage systems.",,11/14/2012,11/14/2012,storage,www.needhamco.com/Default/InstitutionalSalesAndTrading/Conferences.aspx,,,0,dfrancis,OK
,2013 CES Unveiled LONDON,The Consumer Electronics Association has taken the CES Unveiled property international with the second annual CES Unveiled LONDON. Executives from CEA’s market research department will present holiday sales and hot tech trends forecasts to top European journalists along with CES announcements.,Inmarsat Conference Center,11/15/2012,11/15/2012,consumer electronics,ce.org/Events-and-Awards/Events/2012-Events/CES-Unveiled-LONDON,,,0,dfrancis,FALSE
,Digital Hollywood New York 2012,Digital Hollywood,McGraw Hill Building,11/15/2012,11/16/2012,"digital, hollywood",www.digitalhollywood.com/NewYorkAgenda.html,,,0,mbrennan,FALSE
,William Blair Financial Services & Technology Summit 2012,"Our Second Annual Financial Services and Technology Summit is likely to include roughly 15 companies, with leadership available for one-on-one meetings throughout the day and a lunch panel discussion. Analysts Robert Napoli and Christopher Shutler, CFA, will host the event.",,11/15/2012,11/15/2012,financial services,www.wmblair.com/,,,0,mbrennan,OK
,SES Singapore 2012,"SES Singapore 2012 will be packed with inspiring presentations, case studies and panel discussions covering PPC management, keyword research, SEO, social media, local, mobile, link building, email, duplicate content, multiple site issues, video optimization and usability, plus an exclusive 'meet the experts' session, networking events, parties and more.",Singapore Marriott Hotel,11/22/2012,11/23/2012,digital marketing,sesconference.com/singapore/,,,0,dfrancis,FALSE
,RSNA 2012,"This November, nearly 60,000 of your colleagues from across the globe will converge on Chicago to witness the latest discoveries, techniques and innovations. Join us for the world’s most important annual event in medical imaging",McCormick Place,11/25/2012,11/30/2012,Medical imaginging,rsna2012.rsna.org/,,,0,mbrennan,FALSE
,Gilbane Conference Boston 2012,"Conference on content and information technologies for digital marketing, collaboration, and web and mobile publishing, including content management, analytics, search, social software",InterContinental Boston,11/27/2012,11/29/2012,"Web Content Management, Mobile development frameworks, Responsive design & HTML5, Digital marketing, Web and mobile analytics, Localization & multilingual technologies, Mobile publishing workflows, App development strategies, Social software platforms, Digital asset management, Big data",gilbaneboston.com/,,,0,mbrennan,FALSE
